Name,Website,One Liner,type,AIIA,Open Source,"Life Cycle - Resource Management, Deep Learning Enablement",Life Cycle - Data Gathering and Transformation,"Life Cycle - Experimenting, Training, Tuning, Testing","Life Cycle - Productionization, Deployment, Inference","Life Cycle - Monitoring, Auditing, Management, Retraining",twitter,Review,Last Modified,Last Modified By
Determined AI,https://determined.ai/,Determined AI lets data science teams train models faster using state-of-the-art distributed training. It also lets those teams find better models with advanced hyperparameter tuning.,AI Infrastructure,checked,,Highly Developed,Lightly Developed,Highly Developed,Moderately Developed,Lightly Developed,https://twitter.com/DeterminedAI,,6/22/2021 1:17pm,Poga Po
Pachyderm,https://www.pachyderm.com/?__hstc=202328270.0ca9907668872c261d4c08d769afee0f.1623124434802.1623917087851.1623985085634.3&__hssc=202328270.1.1623985085634&__hsfp=2586253386,Pachyderm delivers a robust data versioning and data lineage platform for AI/ML that acts like Git for data.,AI Infrastructure,checked,checked,,Highly Developed,Still Developing,Highly Developed,,https://twitter.com/pachyderminc,,6/22/2021 1:14pm,Poga Po
Seldon,https://www.seldon.io/,Seldon accelerates the adoption of machine learning technologies to solve the world most challenging problems with a diverse and growing set of applications.,AI Infrastructure,checked,checked,,,,Highly Developed,Highly Developed,https://twitter.com/seldon_io,,6/18/2021 2:53pm,Poga Po
Algorithmia,https://algorithmia.com/,"For machine learning leaders that need to put ML models into production faster, more securely, and cost-effectively within their existing operational processes, Algorithmia is machine learning operations (MLOps) software that manages all stages of the ML lifecycle.",AI Infrastructure,checked,,,,,Highly Developed,Highly Developed,https://twitter.com/algorithmia,,6/18/2021 2:35pm,catcatcatcat Hong
Maiot,https://zenml.io/,Maiot‘s mission is to enable production-ready ML code.,AI Infrastructure,checked,checked,,Moderately Developed,Highly Developed,Still Developing,,https://twitter.com/maiotees,,6/22/2021 1:14pm,Poga Po
ClearML,https://clear.ml/,"ClearML MLOps platform automates and simplifies developing, managing and deploying machine learning solutions by giving data scientists simple plug & play tools for experiment management, workload orchestration, data operations (feature stores & data pipelines) and deployment solutions that integrate into any tool chain.",AI Infrastructure,checked,checked,Moderately Developed,Moderately Developed,Highly Developed,Still Developing,,https://twitter.com/clearmlapp,,6/22/2021 1:19pm,Poga Po
Superb AI ,https://www.superb-ai.com/,Superb AI is a training data platform built by a team of researchers and engineers.,AI Infrastructure,checked,,,Highly Developed,,,,https://twitter.com/superb_hq,,6/22/2021 1:14pm,Poga Po
Terminus DB,https://terminusdb.com/,"Terminus DB brings a distributed, revision control database to data science teams across the world.",AI Infrastructure,checked,checked,,Highly Developed,Moderately Developed,Lightly Developed,Moderately Developed,https://twitter.com/TerminusDB,,6/22/2021 1:14pm,Poga Po
Neu.ro Inc.,http://neu.ro/,Neu.ro Inc. is a technology company using state-of-the-art Machine Learning (ML) and Deep Learning (DL) to solve real-world problems for business and science.,AI Infrastructure,checked,,,Lightly Developed,Moderately Developed,Lightly Developed,Lightly Developed,https://twitter.com/NeuroPlatform,,6/22/2021 1:14pm,Poga Po
YData,https://ydata.ai/,YData is a data-centric platform that democratizes the access to valuable data and allows Data Scientists to build and deploy better AI solutions with high-quality and synthetic data,AI Infrastructure,checked,,,Highly Developed,Moderately Developed,Lightly Developed,,https://twitter.com/YData_ai,,6/22/2021 1:14pm,Poga Po
Fiddler,https://www.fiddler.ai/,"Fiddler’s mission is to enable businesses of all sizes to build, deploy, and maintain trustworthy AI solutions.",AI Infrastructure,checked,checked,,,Lightly Developed,Moderately Developed,Highly Developed,https://twitter.com/fiddlerlabs,,6/18/2021 2:31pm,catcatcatcat Hong
DAGsHub,https://dagshub.com,"DAGsHub is a data science platform for tracking experiments, versioning data, models, and pipelines, using Git.",AI Infrastructure,checked,,,,Highly Developed,,,https://twitter.com/TheRealDAGsHub,,6/18/2021 2:56pm,Poga Po
Tecton,https://www.tecton.ai/,"Tecton provides an enterprise feature store that makes it easy to build, deploy, and share features for machine learning.",AI Infrastructure,checked,,,,Still Developing,Highly Developed,Moderately Developed,https://twitter.com/TectonAI,,6/18/2021 2:30pm,catcatcatcat Hong
Superwise.ai,https://www.superwise.ai/,Superwise.ai enables data science and operational teams to monitor and assure the health of their AI-based systems.,AI Infrastructure,checked,,,,,Moderately Developed,Highly Developed,https://twitter.com/SuperwiseAI,,6/18/2021 2:29pm,catcatcatcat Hong
Valohai,https://valohai.com/,Valohai is an end-to-end MLOps platform for machine learning and deep learning.,AI Infrastructure,checked,,,,Moderately Developed,Moderately Developed,,https://twitter.com/valohaiai,,6/18/2021 2:33pm,catcatcatcat Hong
WhyLabs,https://whylabs.ai/,"WhyLabs is the AI Observability company behind whylogs – the standard for data logging. The platform provides model monitoring to surface and resolve data quality issues, data bias and concept drift.",AI Infrastructure,checked,,,,,,Highly Developed,https://twitter.com/WhyLabs,,6/18/2021 2:30pm,catcatcatcat Hong
cnvrg.io,http://cnvrg.io/,"cnvrg.io is an AI OS, transforming the way enterprises manage, scale and accelerate AI and data science development from research to production. ",AI Infrastructure,checked,,Highly Developed,,Highly Developed,,,https://twitter.com/cnvrg_io,,6/22/2021 1:22pm,Poga Po
Arize AI,https://arize.com/,"Arize AI acts as the guardrail on AI as it’s deployed in the real world, ensuring blackbox systems act transparently, ethically and without bias.",AI Infrastructure,checked,,,Still Developing,,,Highly Developed,https://twitter.com/arizeai,,6/22/2021 1:14pm,Poga Po
UbiOps,https://ubiops.com/,"UbiOps is a deployment, serving and orchestration backend for your data science and data processing code.",AI Infrastructure,checked,,,,,Moderately Developed,Still Developing,https://twitter.com/UbiOps_,,6/18/2021 2:33pm,catcatcatcat Hong
Comet,http://comet.ml/,"Comet provides a self-hosted and cloud-based MLOps solution that enables data scientists and teams to track, compare, explain and optimize experiments and models.",AI Infrastructure,checked,,,,Lightly Developed,Moderately Developed,Moderately Developed,https://twitter.com/Cometml,,6/18/2021 2:32pm,catcatcatcat Hong
Iguazio,http://www.iguazio.com/,"Iguazio’s Data Science & MLOps Platform enables enterprises to develop, deploy and manage their AI applications, drastically simplifying and reducing the time required to create real business value with AI. ",AI Infrastructure,checked,,,Moderately Developed,,Still Developing,Still Developing,https://twitter.com/iguazio,,6/22/2021 1:14pm,Poga Po
Arthur,https://www.arthur.ai/,Arthur is the ML model monitoring platform that gives organizations the confidence their AI deployments are performing at peak.,AI Infrastructure,checked,checked,,,,Lightly Developed,Moderately Developed,https://twitter.com/itsArthurAI,,6/22/2021 1:13pm,Poga Po
New Relic,https://newrelic.com/,"New Relic AI helps you detect, understand, and resolve incidents faster with the easiest-to-use, most powerful AIOps capabilities that reduce alert noise and find insights in the data that would go unnoticed without machine learning.",AI Infrastructure,checked,,,,,,Highly Developed,https://twitter.com/newrelic,,6/18/2021 2:37pm,catcatcatcat Hong
Spell,https://spell.ml/,"Spell offers a leading MLops platform designed for modern ML engineering teams to discover deeper insights, deploy models faster, and deliver cost-savings for the business.",AI Infrastructure,checked,,Moderately Developed,,Still Developing,Moderately Developed,,https://twitter.com/spell_ml,,6/22/2021 1:23pm,Poga Po
OctoML,https://octoml.ai/,OctoML applies cutting edge AI to make it easier and faster to put machine learning models into production on any hardware.,AI Infrastructure,checked,,,,,Highly Developed,Still Developing,https://twitter.com/octoml,,6/18/2021 2:30pm,catcatcatcat Hong
ModelOp,https://www.modelop.com/,"ModelOp, the pioneer of ModelOps software, enables large enterprises to address the critical governance and scale challenges necessary to fully unlock the transformational value of enterprise AI and Machine Learning investments.",AI Infrastructure,checked,,,,,Moderately Developed,Moderately Developed,https://twitter.com/ModelOp_Co,,6/18/2021 2:36pm,catcatcatcat Hong
Auger.AI,http://auger.ai/,"Auger.AI offers products focused on machine learning accuracy.  The primary product is our accuracy monitoring product MLRAM, which focuses on detecting and correct model drift.   MLRAM works with any cloud-based machine learning platform.",AI Infrastructure,checked,,,,Moderately Developed,,Highly Developed,https://twitter.com/AiAuger,,6/18/2021 2:32pm,catcatcatcat Hong
AI Labs,https://www.ai-labs.co.uk/,AI Labs is based in the UK and has a unique blend of high value design and manufacturing industry domain knowledge and expertise in cutting edge AI technology. Our aim is to make complex AI technology simple to use and thereby accelerate AI adoption and digital transformation journeys of our customers.,AI Infrastructure,checked,,,,,,,https://twitter.com/AI_LabsUK,,6/18/2021 2:29pm,catcatcatcat Hong
Snitch AI,https://www.snit.ch/,"Snitch AI provides automated scientific validation for machine learning models in a few clicks, without the need to become an expert. We assist data science team to assess the quality of their models that are developing",AI Infrastructure,checked,,,,,,Highly Developed,https://twitter.com/snitch_ai,,6/18/2021 2:37pm,catcatcatcat Hong
Sama,https://www.sama.com/,Sama provides accurate data for ambitious AI. The company’s high-quality training data platform is trusted by the world’s most ambitious organizations to develop accurate machine learning models. ,AI Infrastructure,checked,,,Highly Developed,,,,https://twitter.com/SamaAI,,6/22/2021 1:14pm,Poga Po
PrimeHub,https://infuseai.io/,"InfuseAI builds PrimeHub, an open-source pluggable MLOps platform. PrimeHub equips enterprises with consistent yet flexible tools to develop, train, and deploy ML models at scale.",AI Infrastructure,checked,checked,Highly Developed,,Highly Developed,Highly Developed,Still Developing,https://twitter.com/InfuseAI,,6/22/2021 1:16pm,Poga Po
Molecula,https://www.molecula.com/,Molecula allows businesses to operationalize AI projects through a novel data format and purpose-built feature storage system.,AI Infrastructure,checked,,,,Moderately Developed,Highly Developed,,https://twitter.com/molecula,,6/18/2021 2:34pm,catcatcatcat Hong
Toloka,https://toloka.ai/,"Toloka is a crowdsourcing platform. Designed by engineers for engineers, Toloka lets you integrate an on-demand workforce directly into your processes",AI Infrastructure,checked,,,Highly Developed,,,,https://twitter.com/TolokaAI,,6/22/2021 1:14pm,Poga Po
Neptune,https://neptune.ai/,"Neptune is a metadata store for MLOps, built for research and production teams that run a lot of experiments",AI Infrastructure,checked,,Still Developing,,,Moderately Developed,Highly Developed,https://twitter.com/neptune_ai,,6/22/2021 1:25pm,Poga Po
Gretel.ai,https://gretel.ai/ ,"Gretel.ai automates privacy engineering, enabling companies to reduce the time to access sensitive data by up to 10x and backed by mathematical privacy guarantees.",AI Infrastructure,checked,,,Highly Developed,,,,https://twitter.com/gretel_ai,,6/22/2021 1:14pm,Poga Po
MindsDB,https://mindsdb.com/,MindsDB helps anyone use the power of machine learning to ask predictive questions of their data and receive accurate answers from it.,AI Infrastructure,checked,checked,,Moderately Developed,Highly Developed,,,https://twitter.com/MindsDB,,6/22/2021 1:14pm,Poga Po
TruEra,https://truera.com/,"TruEra provides the first AI Quality Management System to help enterprises Develop, Adopt and Monitor ML models.",AI Infrastructure,checked,,,,,Moderately Developed,Highly Developed,https://twitter.com/truera_ai,,6/18/2021 2:25pm,catcatcatcat Hong
Hobeypotz,https://honeypotz.net/,Honeypotz Inc provides an end-to-end platform AIStudio.ml for MLops based on  Open-source Kubeflow Pipelines. ,AI Infrastructure,checked,,,,,,,https://twitter.com/Honeypotz4,,6/18/2021 2:27pm,catcatcatcat Hong
Bodywork,https://www.bodyworkml.com/,"Bodywork develop open-source tools for ML engineers. We focus on bridging the gap between research-led solutions and fully-operational ML systems, helping to create a path to production that is fast, reliable and repeatable.",AI Infrastructure,checked,checked,,,,Highly Developed,,https://twitter.com/bodyworkml,,6/18/2021 4:31pm,catcatcatcat Hong
LatticeFlow,https://latticeflow.ai/,LatticeFlow is a spin-off from ETH Zurich building a product to help organizations deliver trustworthy AI models.,AI Infrastructure,checked,,,,Moderately Developed,Moderately Developed,Lightly Developed,https://twitter.com/latticeflowai,,6/18/2021 4:50pm,catcatcatcat Hong
Acceldata,https://www.acceldata.io/,"Acceldata delivers a comprehensive data observability platform that synthesizes signals across data, processing, and pipelines to transform how organizations build, operate, and optimize enterprise data systems.",AI Infrastructure,checked,,,,,,Highly Developed,https://twitter.com/acceldataio,,6/18/2021 4:49pm,catcatcatcat Hong
ixpantia,https://www.ixpantia.com/,At ixpantia our passionate and experienced data scientists and business consultants work with organizations around the world to empower them to innovate with a data-driven approach.,AI Infrastructure,checked,,,Moderately Developed,,,,https://twitter.com/ixpantia,,6/22/2021 1:14pm,Poga Po
DataArt,https://www.dataart.com/,DataArt is a global software engineering firm that takes a uniquely human approach to solving problems.,Solutions Integrators,checked,,,,,,,https://twitter.com/DataArtUK,,6/18/2021 2:35pm,catcatcatcat Hong
INNOQ,https://www.innoq.com/,"At INNOQ, we give technology a purpose. We future-proof your ideas. Honest consulting, innovative thinking, and a passion for software development means: We deliver successful software solutions, infrastructure, and business models.",Solutions Integrators,checked,,,,,,,https://twitter.com/INNOQ,,6/18/2021 2:36pm,catcatcatcat Hong
SFL Scientific,https://www.sflscientific.com/,SFL Scientific is a US-based data science consulting and professional services firm.,Solutions Integrators,checked,,,,,,,https://twitter.com/sflscientific,,6/18/2021 2:34pm,catcatcatcat Hong
Canonical,https://canonical.com/,"Canonical publishes Ubuntu – the most used OS in ML development and production – and packages open source MLOps solutions for the enterprise, with security, support and consulting services. ",infrastructure,checked,checked,,,,,,https://twitter.com/Canonical,,6/18/2021 2:36pm,catcatcatcat Hong
Platform9,https://platform9.com/,"Build Kubernetes Clusters Anywhere – Fast & Easy. Platform9 Managed Kubernetes (PMK) is a SaaS managed offering, providing the simplest tool to manage all your complex Kubernetes needs, anywhere – on-premises, in public clouds or at the edge.",infrastructure,checked,,,,,,,https://twitter.com/Platform9Sys,,6/18/2021 2:35pm,catcatcatcat Hong
Juice Labs,https://www.juicelabs.co/,"Juice Labs‘ drop-in-anywhere software pools and shares GPUs remotely to keep utilization near 100%, helping any organization get smart about their GPU usage – and drive more business value for less.",infrastructure,checked,,,,,,,,,6/18/2021 12:04pm,Poga Po
,,,,,,,,,,,,,,
Inferrd,https://inferrd.com/,"Deploying machine learning models is hard! So we built Inferrd. In minutes, you can deploy machine learning models from your notebook, do A/B testing and track data drift with no need for a developer or hosting.",AI Infrastructure,,,,,,Highly Developed,Moderately Developed,https://twitter.com/inferrd,https://www.notion.so/infuseai/Inferrd-c33b6ad612ba4b5f9b5cd7ea0e9e1266,6/21/2021 6:28am,catcatcatcat Hong
MLFlow,https://mlflow.org/,An open source platform for the machine learning lifecycle,AI Infrastructure,,checked,Lightly Developed,,Lightly Developed,Lightly Developed,Lightly Developed,https://twitter.com/MLflow,,6/22/2021 1:15pm,Poga Po
Iterative,https://iterative.ai/,Open platform to operationalize AI,AI Infrastructure,,checked,,,,Still Developing,Highly Developed,https://twitter.com/DVCorg,,6/21/2021 6:26am,catcatcatcat Hong
Airbytes,https://airbyte.io/,"Open data integration for modern data teams
Get your data pipelines running in minutes. With pre-built or custom connectors. From our UI, API or CLI.​",AI Infrastructure,,checked,,Highly Developed,,,,https://twitter.com/airbytehq,,6/22/2021 1:14pm,Poga Po
Kubeflow,https://www.kubeflow.org/,The Machine Learning Toolkit for Kubernetes,AI Infrastructure,,checked,Still Developing,Lightly Developed,Still Developing,Still Developing,,https://twitter.com/kubeflow,,6/22/2021 1:15pm,Poga Po
Coiled,https://coiled.io/,"Coiled helps data scientists use Python for ambitious problems, scaling to the cloud for computing power, ease, and speed—all tuned for the needs of teams and enterprise.",AI Infrastructure,,,Highly Developed,,Moderately Developed,,,,,6/22/2021 1:16pm,Poga Po
,,,,,,,,,,,,,,
,,,,,,,,,,,,,,
,,,,,,,,,,,,,,
,,,,,,,,,,,,,,